<?xml version="1.0" encoding="UTF-8"?>
<!DOCTYPE palette SYSTEM "somtoolboxPalette.dtd">

<!-- Color-Palette for SOMViewer -->
<palette version="1.0" hidden="true">
  <shortName>TuxElevation</shortName>
  <longName>TuxRacer Elevation Palette</longName>
  <description>This Palette is used for the TuxRacer</description>
  <colors colorCount="256">
    <color>
      <gradientPoint>0.0</gradientPoint>
      <red>0</red>
      <green>0</green>
      <blue>0</blue>
    </color>
    <color>
      <gradientPoint>0.35</gradientPoint>
      <red>0</red>
      <green>0</green>
      <blue>0</blue>
    </color>
    <color>
      <gradientPoint>0.9</gradientPoint>
      <red>255</red>
      <green>255</green>
      <blue>255</blue>
    </color>
    <color>
      <gradientPoint>1.0</gradientPoint>
      <red>255</red>
      <green>255</green>
      <blue>255</blue>
    </color>
  </colors>
</palette>

