<?xml version="1.0" encoding="UTF-8"?>
<!DOCTYPE palette SYSTEM "somtoolboxPalette.dtd">

<!-- Color-Palette for SOMViewer -->
<palette version="1.0" group="RGB">
  <shortName>RGB256</shortName>
  <longName>RGB, 256 Gradient</longName>
  <description />
  <colors colorCount="256">
    <color>
      <gradientPoint>0.0</gradientPoint>
      <red>255</red>
      <green>0</green>
      <blue>0</blue>
    </color>
    <color>
      <gradientPoint>0.25</gradientPoint>
      <red>255</red>
      <green>255</green>
      <blue>0</blue>
    </color>
    <color>
      <gradientPoint>0.5</gradientPoint>
      <red>0</red>
      <green>255</green>
      <blue>0</blue>
    </color>
    <color>
      <gradientPoint>0.75</gradientPoint>
      <red>0</red>
      <green>255</green>
      <blue>255</blue>
    </color>
    <color>
      <gradientPoint>1.0</gradientPoint>
      <red>0</red>
      <green>0</green>
      <blue>255</blue>
    </color>
  </colors>
</palette>

