<?xml version="1.0" encoding="UTF-8"?>
<!DOCTYPE palette SYSTEM "somtoolboxPalette.dtd">

<!-- Color-Palette for SOMViewer -->
<palette version="1.0" group="Single Color">
  <shortName>Redscale32</shortName>
  <longName>Redscale, 32 Gradient</longName>
  <description>Original palette for the Component Planes</description>
  <colors>
    <color>
      <red>255</red>
      <green>255</green>
      <blue>255</blue>
    </color>
    <color>
      <red>255</red>
      <green>248</green>
      <blue>248</blue>
    </color>
    <color>
      <red>255</red>
      <green>241</green>
      <blue>240</blue>
    </color>
    <color>
      <red>255</red>
      <green>234</green>
      <blue>232</blue>
    </color>
    <color>
      <red>255</red>
      <green>227</green>
      <blue>224</blue>
    </color>
    <color>
      <red>255</red>
      <green>220</green>
      <blue>216</blue>
    </color>
    <color>
      <red>255</red>
      <green>213</green>
      <blue>208</blue>
    </color>
    <color>
      <red>255</red>
      <green>206</green>
      <blue>200</blue>
    </color>
    <color>
      <red>255</red>
      <green>199</green>
      <blue>192</blue>
    </color>
    <color>
      <red>255</red>
      <green>192</green>
      <blue>184</blue>
    </color>
    <color>
      <red>255</red>
      <green>185</green>
      <blue>176</blue>
    </color>
    <color>
      <red>255</red>
      <green>178</green>
      <blue>168</blue>
    </color>
    <color>
      <red>255</red>
      <green>171</green>
      <blue>160</blue>
    </color>
    <color>
      <red>255</red>
      <green>164</green>
      <blue>152</blue>
    </color>
    <color>
      <red>255</red>
      <green>157</green>
      <blue>144</blue>
    </color>
    <color>
      <red>255</red>
      <green>150</green>
      <blue>136</blue>
    </color>
    <color>
      <red>255</red>
      <green>143</green>
      <blue>128</blue>
    </color>
    <color>
      <red>255</red>
      <green>136</green>
      <blue>120</blue>
    </color>
    <color>
      <red>255</red>
      <green>129</green>
      <blue>112</blue>
    </color>
    <color>
      <red>255</red>
      <green>122</green>
      <blue>104</blue>
    </color>
    <color>
      <red>255</red>
      <green>115</green>
      <blue>96</blue>
    </color>
    <color>
      <red>255</red>
      <green>108</green>
      <blue>88</blue>
    </color>
    <color>
      <red>255</red>
      <green>101</green>
      <blue>80</blue>
    </color>
    <color>
      <red>255</red>
      <green>94</green>
      <blue>72</blue>
    </color>
    <color>
      <red>255</red>
      <green>87</green>
      <blue>64</blue>
    </color>
    <color>
      <red>255</red>
      <green>80</green>
      <blue>56</blue>
    </color>
    <color>
      <red>255</red>
      <green>73</green>
      <blue>48</blue>
    </color>
    <color>
      <red>255</red>
      <green>66</green>
      <blue>40</blue>
    </color>
    <color>
      <red>255</red>
      <green>59</green>
      <blue>32</blue>
    </color>
    <color>
      <red>255</red>
      <green>52</green>
      <blue>24</blue>
    </color>
    <color>
      <red>255</red>
      <green>45</green>
      <blue>16</blue>
    </color>
    <color>
      <red>255</red>
      <green>38</green>
      <blue>8</blue>
    </color>
  </colors>
</palette>

