<?xml version="1.0" encoding="UTF-8"?>
<!DOCTYPE palette SYSTEM "somtoolboxPalette.dtd">

<!-- Color-Palette for SOMViewer -->
<palette version="1.0" group="RGB">
  <shortName>M-SOMToolbox</shortName>
  <longName>Matlab SOMToolbox UMatrix</longName>
  <description />
  <colors representation="real">
    <color>
      <red>0</red>
      <green>0</green>
      <blue>0.5625</blue>
    </color>
    <color>
      <red>0</red>
      <green>0</green>
      <blue>0.6250</blue>
    </color>
    <color>
      <red>0</red>
      <green>0</green>
      <blue>0.6875</blue>
    </color>
    <color>
      <red>0</red>
      <green>0</green>
      <blue>0.7500</blue>
    </color>
    <color>
      <red>0</red>
      <green>0</green>
      <blue>0.8125</blue>
    </color>
    <color>
      <red>0</red>
      <green>0</green>
      <blue>0.8750</blue>
    </color>
    <color>
      <red>0</red>
      <green>0</green>
      <blue>0.9375</blue>
    </color>
    <color>
      <red>0</red>
      <green>0</green>
      <blue>1.0000</blue>
    </color>
    <color>
      <red>0</red>
      <green>0.0625</green>
      <blue>1.0000</blue>
    </color>
    <color>
      <red>0</red>
      <green>0.1250</green>
      <blue>1.0000</blue>
    </color>
    <color>
      <red>0</red>
      <green>0.1875</green>
      <blue>1.0000</blue>
    </color>
    <color>
      <red>0</red>
      <green>0.2500</green>
      <blue>1.0000</blue>
    </color>
    <color>
      <red>0</red>
      <green>0.3125</green>
      <blue>1.0000</blue>
    </color>
    <color>
      <red>0</red>
      <green>0.3750</green>
      <blue>1.0000</blue>
    </color>
    <color>
      <red>0</red>
      <green>0.4375</green>
      <blue>1.0000</blue>
    </color>
    <color>
      <red>0</red>
      <green>0.5000</green>
      <blue>1.0000</blue>
    </color>
    <color>
      <red>0</red>
      <green>0.5625</green>
      <blue>1.0000</blue>
    </color>
    <color>
      <red>0</red>
      <green>0.6250</green>
      <blue>1.0000</blue>
    </color>
    <color>
      <red>0</red>
      <green>0.6875</green>
      <blue>1.0000</blue>
    </color>
    <color>
      <red>0</red>
      <green>0.7500</green>
      <blue>1.0000</blue>
    </color>
    <color>
      <red>0</red>
      <green>0.8125</green>
      <blue>1.0000</blue>
    </color>
    <color>
      <red>0</red>
      <green>0.8750</green>
      <blue>1.0000</blue>
    </color>
    <color>
      <red>0</red>
      <green>0.9375</green>
      <blue>1.0000</blue>
    </color>
    <color>
      <red>0</red>
      <green>1.0000</green>
      <blue>1.0000</blue>
    </color>
    <color>
      <red>0.0625</red>
      <green>1.0000</green>
      <blue>0.9375</blue>
    </color>
    <color>
      <red>0.1250</red>
      <green>1.0000</green>
      <blue>0.8750</blue>
    </color>
    <color>
      <red>0.1875</red>
      <green>1.0000</green>
      <blue>0.8125</blue>
    </color>
    <color>
      <red>0.2500</red>
      <green>1.0000</green>
      <blue>0.7500</blue>
    </color>
    <color>
      <red>0.3125</red>
      <green>1.0000</green>
      <blue>0.6875</blue>
    </color>
    <color>
      <red>0.3750</red>
      <green>1.0000</green>
      <blue>0.6250</blue>
    </color>
    <color>
      <red>0.4375</red>
      <green>1.0000</green>
      <blue>0.5625</blue>
    </color>
    <color>
      <red>0.5000</red>
      <green>1.0000</green>
      <blue>0.5000</blue>
    </color>
    <color>
      <red>0.5625</red>
      <green>1.0000</green>
      <blue>0.4375</blue>
    </color>
    <color>
      <red>0.6250</red>
      <green>1.0000</green>
      <blue>0.3750</blue>
    </color>
    <color>
      <red>0.6875</red>
      <green>1.0000</green>
      <blue>0.3125</blue>
    </color>
    <color>
      <red>0.7500</red>
      <green>1.0000</green>
      <blue>0.2500</blue>
    </color>
    <color>
      <red>0.8125</red>
      <green>1.0000</green>
      <blue>0.1875</blue>
    </color>
    <color>
      <red>0.8750</red>
      <green>1.0000</green>
      <blue>0.1250</blue>
    </color>
    <color>
      <red>0.9375</red>
      <green>1.0000</green>
      <blue>0.0625</blue>
    </color>
    <color>
      <red>1.0000</red>
      <green>1.0000</green>
      <blue>0</blue>
    </color>
    <color>
      <red>1.0000</red>
      <green>0.9375</green>
      <blue>0</blue>
    </color>
    <color>
      <red>1.0000</red>
      <green>0.8750</green>
      <blue>0</blue>
    </color>
    <color>
      <red>1.0000</red>
      <green>0.8125</green>
      <blue>0</blue>
    </color>
    <color>
      <red>1.0000</red>
      <green>0.7500</green>
      <blue>0</blue>
    </color>
    <color>
      <red>1.0000</red>
      <green>0.6875</green>
      <blue>0</blue>
    </color>
    <color>
      <red>1.0000</red>
      <green>0.6250</green>
      <blue>0</blue>
    </color>
    <color>
      <red>1.0000</red>
      <green>0.5625</green>
      <blue>0</blue>
    </color>
    <color>
      <red>1.0000</red>
      <green>0.5000</green>
      <blue>0</blue>
    </color>
    <color>
      <red>1.0000</red>
      <green>0.4375</green>
      <blue>0</blue>
    </color>
    <color>
      <red>1.0000</red>
      <green>0.3750</green>
      <blue>0</blue>
    </color>
    <color>
      <red>1.0000</red>
      <green>0.3125</green>
      <blue>0</blue>
    </color>
    <color>
      <red>1.0000</red>
      <green>0.2500</green>
      <blue>0</blue>
    </color>
    <color>
      <red>1.0000</red>
      <green>0.1875</green>
      <blue>0</blue>
    </color>
    <color>
      <red>1.0000</red>
      <green>0.1250</green>
      <blue>0</blue>
    </color>
    <color>
      <red>1.0000</red>
      <green>0.0625</green>
      <blue>0</blue>
    </color>
    <color>
      <red>1.0000</red>
      <green>0</green>
      <blue>0</blue>
    </color>
    <color>
      <red>0.9375</red>
      <green>0</green>
      <blue>0</blue>
    </color>
    <color>
      <red>0.8750</red>
      <green>0</green>
      <blue>0</blue>
    </color>
    <color>
      <red>0.8125</red>
      <green>0</green>
      <blue>0</blue>
    </color>
    <color>
      <red>0.7500</red>
      <green>0</green>
      <blue>0</blue>
    </color>
    <color>
      <red>0.6875</red>
      <green>0</green>
      <blue>0</blue>
    </color>
    <color>
      <red>0.6250</red>
      <green>0</green>
      <blue>0</blue>
    </color>
    <color>
      <red>0.5625</red>
      <green>0</green>
      <blue>0</blue>
    </color>
    <color>
      <red>0.5000</red>
      <green>0</green>
      <blue>0</blue>
    </color>
  </colors>
</palette>

