<?xml version="1.0" encoding="UTF-8"?>
<!DOCTYPE palette SYSTEM "somtoolboxPalette.dtd">

<!-- Color-Palette for SOMViewer -->
<palette version="1.0" group="Cartography">
  <shortName>Matlab SDH</shortName>
  <longName>Matlab SDH</longName>
  <description>SDH Palette as in the original MATLAB implementation</description>
  <colors>
    <color>
      <red>0</red>
      <green>0</green>
      <blue>128</blue>
    </color>
    <color>
      <red>0</red>
      <green>0</green>
      <blue>134</blue>
    </color>
    <color>
      <red>0</red>
      <green>0</green>
      <blue>140</blue>
    </color>
    <color>
      <red>0</red>
      <green>0</green>
      <blue>147</blue>
    </color>
    <color>
      <red>0</red>
      <green>0</green>
      <blue>153</blue>
    </color>
    <color>
      <red>0</red>
      <green>0</green>
      <blue>159</blue>
    </color>
    <color>
      <red>0</red>
      <green>0</green>
      <blue>166</blue>
    </color>
    <color>
      <red>0</red>
      <green>0</green>
      <blue>172</blue>
    </color>
    <color>
      <red>0</red>
      <green>0</green>
      <blue>179</blue>
    </color>
    <color>
      <red>0</red>
      <green>0</green>
      <blue>185</blue>
    </color>
    <color>
      <red>0</red>
      <green>0</green>
      <blue>191</blue>
    </color>
    <color>
      <red>0</red>
      <green>0</green>
      <blue>198</blue>
    </color>
    <color>
      <red>0</red>
      <green>0</green>
      <blue>204</blue>
    </color>
    <color>
      <red>0</red>
      <green>0</green>
      <blue>210</blue>
    </color>
    <color>
      <red>0</red>
      <green>0</green>
      <blue>217</blue>
    </color>
    <color>
      <red>0</red>
      <green>0</green>
      <blue>223</blue>
    </color>
    <color>
      <red>0</red>
      <green>0</green>
      <blue>230</blue>
    </color>
    <color>
      <red>0</red>
      <green>0</green>
      <blue>236</blue>
    </color>
    <color>
      <red>0</red>
      <green>0</green>
      <blue>242</blue>
    </color>
    <color>
      <red>0</red>
      <green>0</green>
      <blue>249</blue>
    </color>
    <color>
      <red>0</red>
      <green>0</green>
      <blue>255</blue>
    </color>
    <color>
      <red>255</red>
      <green>255</green>
      <blue>77</blue>
    </color>
    <color>
      <red>255</red>
      <green>255</green>
      <blue>77</blue>
    </color>
    <color>
      <red>0</red>
      <green>102</green>
      <blue>0</blue>
    </color>
    <color>
      <red>0</red>
      <green>105</green>
      <blue>0</blue>
    </color>
    <color>
      <red>0</red>
      <green>107</green>
      <blue>0</blue>
    </color>
    <color>
      <red>0</red>
      <green>110</green>
      <blue>0</blue>
    </color>
    <color>
      <red>0</red>
      <green>112</green>
      <blue>0</blue>
    </color>
    <color>
      <red>0</red>
      <green>115</green>
      <blue>0</blue>
    </color>
    <color>
      <red>0</red>
      <green>117</green>
      <blue>0</blue>
    </color>
    <color>
      <red>0</red>
      <green>120</green>
      <blue>0</blue>
    </color>
    <color>
      <red>0</red>
      <green>122</green>
      <blue>0</blue>
    </color>
    <color>
      <red>0</red>
      <green>125</green>
      <blue>0</blue>
    </color>
    <color>
      <red>0</red>
      <green>128</green>
      <blue>0</blue>
    </color>
    <color>
      <red>0</red>
      <green>130</green>
      <blue>0</blue>
    </color>
    <color>
      <red>0</red>
      <green>133</green>
      <blue>0</blue>
    </color>
    <color>
      <red>0</red>
      <green>135</green>
      <blue>0</blue>
    </color>
    <color>
      <red>0</red>
      <green>138</green>
      <blue>0</blue>
    </color>
    <color>
      <red>0</red>
      <green>140</green>
      <blue>0</blue>
    </color>
    <color>
      <red>0</red>
      <green>143</green>
      <blue>0</blue>
    </color>
    <color>
      <red>0</red>
      <green>145</green>
      <blue>0</blue>
    </color>
    <color>
      <red>0</red>
      <green>148</green>
      <blue>0</blue>
    </color>
    <color>
      <red>0</red>
      <green>150</green>
      <blue>0</blue>
    </color>
    <color>
      <red>0</red>
      <green>153</green>
      <blue>0</blue>
    </color>
    <color>
      <red>0</red>
      <green>153</green>
      <blue>0</blue>
    </color>
    <color>
      <red>7</red>
      <green>155</green>
      <blue>7</blue>
    </color>
    <color>
      <red>14</red>
      <green>158</green>
      <blue>14</blue>
    </color>
    <color>
      <red>22</red>
      <green>160</green>
      <blue>22</blue>
    </color>
    <color>
      <red>30</red>
      <green>162</green>
      <blue>30</blue>
    </color>
    <color>
      <red>37</red>
      <green>165</green>
      <blue>37</blue>
    </color>
    <color>
      <red>46</red>
      <green>167</green>
      <blue>46</blue>
    </color>
    <color>
      <red>54</red>
      <green>169</green>
      <blue>54</blue>
    </color>
    <color>
      <red>62</red>
      <green>172</green>
      <blue>62</blue>
    </color>
    <color>
      <red>71</red>
      <green>174</green>
      <blue>71</blue>
    </color>
    <color>
      <red>80</red>
      <green>176</green>
      <blue>80</blue>
    </color>
    <color>
      <red>89</red>
      <green>179</green>
      <blue>89</blue>
    </color>
    <color>
      <red>179</red>
      <green>179</green>
      <blue>179</blue>
    </color>
    <color>
      <red>189</red>
      <green>189</green>
      <blue>189</blue>
    </color>
    <color>
      <red>200</red>
      <green>200</green>
      <blue>200</blue>
    </color>
    <color>
      <red>211</red>
      <green>211</green>
      <blue>211</blue>
    </color>
    <color>
      <red>222</red>
      <green>222</green>
      <blue>222</blue>
    </color>
    <color>
      <red>233</red>
      <green>233</green>
      <blue>233</blue>
    </color>
    <color>
      <red>244</red>
      <green>244</green>
      <blue>244</blue>
    </color>
    <color>
      <red>255</red>
      <green>255</green>
      <blue>255</blue>
    </color>
  </colors>
</palette>

