<?xml version="1.0" encoding="UTF-8"?>
<!DOCTYPE palette SYSTEM "somtoolboxPalette.dtd">

<!-- Color-Palette for SOMViewer -->
<palette version="1.0" group="Cartography">
  <shortName>GISsmooth</shortName>
  <longName>GIS colours, smooth</longName>
  <description />
  <colors>
    <color>
      <red>55</red>
      <green>165</green>
      <blue>75</blue>
    </color>
    <color>
      <red>60</red>
      <green>170</green>
      <blue>80</blue>
    </color>
    <color>
      <red>110</red>
      <green>190</green>
      <blue>120</blue>
    </color>
    <color>
      <red>115</red>
      <green>195</green>
      <blue>125</blue>
    </color>
    <color>
      <red>120</red>
      <green>200</green>
      <blue>130</blue>
    </color>
    <color>
      <red>135</red>
      <green>200</green>
      <blue>140</blue>
    </color>
    <color>
      <red>140</red>
      <green>205</green>
      <blue>145</blue>
    </color>
    <color>
      <red>145</red>
      <green>210</green>
      <blue>150</blue>
    </color>
    <color>
      <red>170</red>
      <green>160</green>
      <blue>100</blue>
    </color>
    <color>
      <red>170</red>
      <green>160</green>
      <blue>100</blue>
    </color>
    <color>
      <red>170</red>
      <green>160</green>
      <blue>100</blue>
    </color>
    <color>
      <red>190</red>
      <green>180</green>
      <blue>125</blue>
    </color>
    <color>
      <red>195</red>
      <green>185</green>
      <blue>130</blue>
    </color>
    <color>
      <red>200</red>
      <green>190</green>
      <blue>135</blue>
    </color>
    <color>
      <red>230</red>
      <green>220</green>
      <blue>160</blue>
    </color>
    <color>
      <red>235</red>
      <green>225</green>
      <blue>165</blue>
    </color>
    <color>
      <red>230</red>
      <green>220</green>
      <blue>160</blue>
    </color>
    <color>
      <red>205</red>
      <green>160</green>
      <blue>105</blue>
    </color>
    <color>
      <red>200</red>
      <green>155</green>
      <blue>100</blue>
    </color>
    <color>
      <red>195</red>
      <green>150</green>
      <blue>95</blue>
    </color>
    <color>
      <red>185</red>
      <green>125</green>
      <blue>75</blue>
    </color>
    <color>
      <red>180</red>
      <green>120</green>
      <blue>70</blue>
    </color>
    <color>
      <red>185</red>
      <green>115</green>
      <blue>65</blue>
    </color>
    <color>
      <red>185</red>
      <green>95</green>
      <blue>40</blue>
    </color>
    <color>
      <red>185</red>
      <green>90</green>
      <blue>35</blue>
    </color>
  </colors>
</palette>

