<?xml version="1.0" encoding="UTF-8"?>
<!DOCTYPE palette SYSTEM "somtoolboxPalette.dtd">

<!-- Color-Palette for SOMViewer -->
<palette version="1.0" group="Cartography">
  <shortName>Mountains10</shortName>
  <longName>Cartography Color, Mountains 10, 10 Colors</longName>
  <description />
  <colors>
    <color>
      <red>175</red>
      <green>240</green>
      <blue>232</blue>
    </color>
    <color>
      <red>220</red>
      <green>250</green>
      <blue>178</blue>
    </color>
    <color>
      <red>83</red>
      <green>183</green>
      <blue>59</blue>
    </color>
    <color>
      <red>101</red>
      <green>148</green>
      <blue>52</blue>
    </color>
    <color>
      <red>240</red>
      <green>157</green>
      <blue>1</blue>
    </color>
    <color>
      <red>139</red>
      <green>11</green>
      <blue>0</blue>
    </color>
    <color>
      <red>104</red>
      <green>40</green>
      <blue>15</blue>
    </color>
    <color>
      <red>139</red>
      <green>95</green>
      <blue>70</blue>
    </color>
    <color>
      <red>189</red>
      <green>189</green>
      <blue>189</blue>
    </color>
    <color>
      <red>254</red>
      <green>252</green>
      <blue>255</blue>
    </color>
  </colors>
</palette>

