<?xml version="1.0" encoding="UTF-8"?>
<!DOCTYPE palette SYSTEM "somtoolboxPalette.dtd">

<!-- Color-Palette for SOMViewer -->
<palette version="1.0" group="RGB">
  <shortName>Crime</shortName>
  <longName>Crime Data</longName>
  <description />
  <colors>
    <color>
      <red>255</red>
      <green>51</green>
      <blue>51</blue>
    </color>
    <color>
      <red>255</red>
      <green>149</green>
      <blue>51</blue>
    </color>
    <color>
      <red>255</red>
      <green>255</green>
      <blue>51</blue>
    </color>
    <color>
      <red>255</red>
      <green>255</green>
      <blue>129</blue>
    </color>
    <color>
      <red>210</red>
      <green>255</green>
      <blue>147</blue>
    </color>
    <color>
      <red>197</red>
      <green>255</green>
      <blue>163</blue>
    </color>
    <color>
      <red>161</red>
      <green>255</green>
      <blue>203</blue>
    </color>
    <color>
      <red>141</red>
      <green>255</green>
      <blue>219</blue>
    </color>
    <color>
      <red>89</red>
      <green>217</green>
      <blue>255</blue>
    </color>
    <color>
      <red>98</red>
      <green>177</green>
      <blue>255</blue>
    </color>
    <color>
      <red>98</red>
      <green>156</green>
      <blue>255</blue>
    </color>
  </colors>
</palette>

